{
  "$schema": "https://json-schema.org/draft/2020-12/schema",
  "$id": "https://github.com/athvin/dagr/schemas/run/v1.schema.json",
  "title": "dagr.run@1",
  "description": "The C22 run artifact: the outcome of one execution, joinable to the structure, derived from the event stream. A single canonical JSON document (T4 §2) with a header (run identity, pipeline identity, both fingerprint hashes, invocation parameters + data interval, allowlisted captured environment, resume lineage, overall outcome), one record PER ATTEMPT, and a summary. Accommodates the assembly-failed / bootstrap-failed variants (no fingerprint, non-empty error list, zero attempts) and the single-node replay variant (`not-requested` node marking). Published by T39 (ticket 050). Schema evolution is additive-only within a version (T0.10): no object sets additionalProperties:false, so unknown future fields validate. MINOR REVISIONS (additive, same major @1, same file — old documents keep validating): @1.1 (T89, ticket 104) adds the optional attempt field `durable_reference_meta`. @1.2 (T90, ticket 105) adds the top-level append-only `outputs` array (produced-output lineage, FK-free) and the optional per-attempt consumed `inputs` array.",
  "type": "object",
  "required": ["header", "attempts"],
  "properties": {
    "header": { "$ref": "#/$defs/header" },
    "attempts": {
      "description": "One record PER ATTEMPT (retries are the interesting signal, C22). Empty for the pre-execution failure variants.",
      "type": "array",
      "items": { "$ref": "#/$defs/attempt" }
    },
    "summary": {
      "description": "Run summary (C22). Null for the pre-execution failure variants (zero attempts).",
      "anyOf": [{ "type": "null" }, { "$ref": "#/$defs/summary" }]
    },
    "outputs": {
      "description": "APPEND-ONLY produced-output lineage (T90, dagr.run@1.2, minor+additive): one entry per durable output produced (or copied forward on resume), in stream order. Each entry is carried BY VALUE — there is NO foreign key to any asset-identity row (the metastore projection is T91). `originating_run` is this run on a fresh produce, or the PRIOR run on a satisfied-from-prior carry-forward. Optional and open-world: a pre-T90 artifact omits it; an empty array is a run that produced no durable output.",
      "type": "array",
      "items": { "$ref": "#/$defs/produced_output" }
    },
    "variant": {
      "description": "Optional artifact variant marker. `single-node-replay` marks a C26 single-node replay artifact whose out-of-request nodes carry the `not-requested` marking.",
      "type": "string",
      "enum": ["single-node-replay"]
    },
    "requested_node": {
      "description": "Single-node-replay: the node the replay was requested for.",
      "type": "string",
      "minLength": 1
    },
    "node_markings": {
      "description": "Single-node-replay: per-node markings. `not-requested` is an ARTIFACT MARKING for nodes outside the request (C22/C26), distinct from any terminal state.",
      "type": "object",
      "additionalProperties": {
        "type": "string",
        "enum": ["requested", "not-requested"]
      }
    }
  },
  "allOf": [
    {
      "description": "A pre-execution failure (assembly-failed or bootstrap-failed) carries a non-empty error list, no fingerprint, and zero attempts (C22).",
      "if": {
        "properties": {
          "header": {
            "properties": {
              "overall_outcome": { "enum": ["assembly-failed", "bootstrap-failed"] }
            }
          }
        }
      },
      "then": {
        "properties": {
          "header": {
            "required": ["errors"],
            "not": {
              "description": "A fingerprint is present ONLY when assembly succeeded, so a pre-execution failure must NOT carry either fingerprint hash.",
              "anyOf": [
                { "required": ["fingerprint_structural"] },
                { "required": ["fingerprint_policy"] }
              ]
            }
          },
          "attempts": {
            "description": "Zero attempts for a pre-execution failure.",
            "maxItems": 0
          }
        }
      }
    }
  ],
  "$defs": {
    "header": {
      "type": "object",
      "required": [
        "run_id",
        "pipeline",
        "parameters",
        "data_interval",
        "captured_environment",
        "resume_lineage",
        "overall_outcome"
      ],
      "properties": {
        "run_id": { "type": "string", "minLength": 1 },
        "pipeline": { "type": "string", "minLength": 1 },
        "fingerprint_structural": {
          "description": "Structural fingerprint (C21), present ONLY when assembly succeeded. Cross-references a graph artifact from the same build.",
          "type": "string",
          "minLength": 1
        },
        "fingerprint_policy": { "type": "string", "minLength": 1 },
        "fingerprint_algorithm_version": { "type": "integer", "minimum": 1 },
        "parameters": { "type": "object" },
        "data_interval": { "type": ["object", "null"] },
        "captured_environment": {
          "description": "Allowlisted captured environment values only, default allowlist empty (C22). Each value is a captured scalar (string/number/boolean); the schema does NOT sanction unbounded (nested-structure) environment capture.",
          "type": "object",
          "additionalProperties": { "type": ["string", "number", "boolean"] }
        },
        "resume_lineage": {
          "description": "Resume lineage: immediate parent and lineage-root run identities, when resumed; null otherwise (C22/C27).",
          "anyOf": [
            { "type": "null" },
            {
              "type": "object",
              "required": ["parent_run_id", "lineage_root_run_id"],
              "properties": {
                "parent_run_id": { "type": "string", "minLength": 1 },
                "lineage_root_run_id": { "type": "string", "minLength": 1 }
              }
            }
          ]
        },
        "overall_outcome": {
          "description": "The overall run outcome. `assembly-failed` and `bootstrap-failed` are DISTINCT pre-execution-failure values (one the graph's fault, the other the machine's).",
          "type": "string",
          "enum": [
            "succeeded",
            "failed",
            "cancelled",
            "assembly-failed",
            "bootstrap-failed"
          ]
        },
        "errors": {
          "description": "The complete error list for a pre-execution failure variant (non-empty when present).",
          "type": "array",
          "minItems": 1,
          "items": { "type": "string", "minLength": 1 }
        }
      }
    },
    "attempt": {
      "type": "object",
      "description": "One attempt record (C22): node identity, attempt number, terminal status from the normative taxonomy, named phase durations, worker, message, structured error detail, reported metrics, declared-vs-measured cost, and the optional durable-output reference (T0.8).",
      "required": [
        "node",
        "attempt",
        "status",
        "phase_durations_ns",
        "worker"
      ],
      "properties": {
        "node": { "type": "string", "minLength": 1 },
        "attempt": {
          "description": "The attempt number (1-based).",
          "type": "integer",
          "minimum": 1
        },
        "status": {
          "description": "Terminal status from the normative taxonomy (arch.md Vocabulary). `not-requested` is NOT here — it is an artifact marking, never a terminal state.",
          "type": "string",
          "enum": [
            "succeeded",
            "failed",
            "timed-out",
            "skipped",
            "upstream-skipped",
            "upstream-failed",
            "cancelled",
            "abandoned",
            "satisfied-from-prior"
          ]
        },
        "phase_durations_ns": {
          "description": "Named phase durations in nanoseconds, computed from monotonic offsets so phases sum to the attempt total exactly (C22).",
          "type": "object",
          "additionalProperties": { "type": "integer", "minimum": 0 }
        },
        "worker": {
          "description": "Which worker ran this attempt.",
          "type": "string",
          "minLength": 1
        },
        "message": { "type": ["string", "null"] },
        "error": {
          "description": "Structured error detail (T3 error taxonomy), when the attempt did not succeed.",
          "type": ["object", "null"]
        },
        "metrics": {
          "description": "Reported metrics — an open numeric map (C23). Keys are metric names carrying units by convention; values are numeric.",
          "type": "object",
          "additionalProperties": { "type": "number" }
        },
        "cost_declared": { "type": ["object", "null"] },
        "cost_measured": { "type": ["object", "null"] },
        "durable_reference": {
          "description": "The durable-output reference (T0.8), present only on a durable node's succeeded attempt or copied forward on resume. OPAQUE to the schema — whatever the task's Reference type serializes to.",
          "type": ["object", "string", "null"]
        },
        "durable_reference_meta": {
          "description": "OPTIONAL durable-reference metadata (T89, dagr.run@1.1, minor+additive): the content hash, size, scheme, and produced-at offset a durable output MAY supply alongside its reference. Present only when the producing DurableOutput impl supplied it; absent otherwise, and absent on every pre-T89 artifact. The content_hash is the impl's OPAQUE digest — dagr computes nothing and only carries it (resume verifies it to refuse on an out-of-band mutation, C27). Additive and open-world: every sub-field is optional and no object is closed, so both a document carrying this and one without it validate.",
          "type": ["object", "null"],
          "properties": {
            "content_hash": { "type": "string", "minLength": 1 },
            "size_bytes": { "type": "integer", "minimum": 0 },
            "scheme": { "type": "string", "minLength": 1 },
            "produced_at_offset_ns": { "type": "integer", "minimum": 0 }
          }
        },
        "satisfied_from_run": {
          "description": "The ORIGINATING run identity a satisfied-from-prior attempt carries (C22/C27). Required when status is satisfied-from-prior (enforced below).",
          "type": "string",
          "minLength": 1
        },
        "inputs": {
          "description": "OPTIONAL consumed durable inputs (T90, dagr.run@1.2, minor+additive): the `{ uri, content_hash }` durable references this attempt actually READ, populated from the resume rehydrate map (on resume) and the resolved static data-edge producers (on a fresh run). Each entry is carried BY VALUE with NO foreign key to any asset row. Present only when the attempt read at least one durable reference; absent otherwise, and absent on every pre-T90 artifact. Additive and open-world.",
          "type": "array",
          "items": {
            "type": "object",
            "required": ["uri"],
            "properties": {
              "uri": { "type": "string", "minLength": 1 },
              "content_hash": { "type": "string", "minLength": 1 }
            }
          }
        }
      },
      "allOf": [
        {
          "if": {
            "properties": { "status": { "const": "satisfied-from-prior" } },
            "required": ["status"]
          },
          "then": {
            "description": "A satisfied-from-prior record MUST carry its originating run identity (C22/C27).",
            "required": ["satisfied_from_run"]
          }
        }
      ]
    },
    "produced_output": {
      "type": "object",
      "description": "One produced-output lineage entry (T90): the producing node/attempt, the produced reference `uri` (by value), the reused T89 `content_hash`/`size_bytes`/`kind`, the produced-at offset, and the originating run. NO foreign key to any asset-identity row.",
      "required": ["node", "attempt", "uri", "produced_at_offset_ns", "originating_run"],
      "properties": {
        "node": { "type": "string", "minLength": 1 },
        "attempt": { "type": "integer", "minimum": 1 },
        "uri": { "type": "string", "minLength": 1 },
        "content_hash": { "type": "string", "minLength": 1 },
        "size_bytes": { "type": "integer", "minimum": 0 },
        "kind": { "type": "string", "minLength": 1 },
        "produced_at_offset_ns": { "type": "integer", "minimum": 0 },
        "originating_run": { "type": "string", "minLength": 1 }
      }
    },
    "summary": {
      "type": "object",
      "description": "Run summary (C22): total elapsed, critical path, peak slot residency, retained values, abandoned-work-pinned time and capacity.",
      "required": [
        "total_elapsed_ns",
        "critical_path_ns",
        "peak_slot_residency",
        "retained_values",
        "abandoned_pinned_time_ns",
        "abandoned_pinned_capacity"
      ],
      "properties": {
        "total_elapsed_ns": { "type": "integer", "minimum": 0 },
        "critical_path_ns": { "type": "integer", "minimum": 0 },
        "peak_slot_residency": { "type": "integer", "minimum": 0 },
        "retained_values": {
          "type": "array",
          "items": { "type": "string" }
        },
        "abandoned_pinned_time_ns": { "type": "integer", "minimum": 0 },
        "abandoned_pinned_capacity": { "type": "integer", "minimum": 0 }
      }
    }
  }
}
