{
  "header": {
    "run_id": "018f4a1e-6c2a-7b3d-9e10-0123456789ad",
    "pipeline": "example-pipeline",
    "fingerprint_structural": "blake3:1111111111111111111111111111111111111111111111111111111111111111",
    "fingerprint_policy": "blake3:2222222222222222222222222222222222222222222222222222222222222222",
    "fingerprint_algorithm_version": 1,
    "parameters": { "date": "2026-07-23" },
    "data_interval": null,
    "captured_environment": {},
    "resume_lineage": {
      "parent_run_id": "018f4a1e-6c2a-7b3d-9e10-0123456789ab",
      "lineage_root_run_id": "018f0000-0000-7000-8000-000000000001"
    },
    "overall_outcome": "succeeded"
  },
  "variant": "single-node-replay",
  "requested_node": "sink",
  "node_markings": {
    "load": "not-requested",
    "sink": "requested"
  },
  "attempts": [
    {
      "node": "sink",
      "attempt": 1,
      "status": "succeeded",
      "phase_durations_ns": { "queued": 10, "running": 90 },
      "worker": "worker-0",
      "message": "ok",
      "error": null,
      "metrics": { "rows_written": 1000 },
      "cost_declared": { "memory_bytes": 1024 },
      "cost_measured": { "memory_bytes": 800 }
    }
  ],
  "summary": {
    "total_elapsed_ns": 100,
    "critical_path_ns": 100,
    "peak_slot_residency": 1,
    "retained_values": ["sink"],
    "abandoned_pinned_time_ns": 0,
    "abandoned_pinned_capacity": 0
  }
}
